{
  "id": "deal_tail_heat",
  "tool": "open",
  "from": "tail",
  "ask": [
    {
      "type": "community.warmth",
      "target": "tail",
      "amount": 1
    }
  ],
  "deadline": 3,
  "gives": [
    {
      "type": "votes",
      "target": "tail",
      "amount": 10
    }
  ],
  "breach": [
    {
      "type": "trust",
      "amount": -3
    }
  ],
  "arc_tags": [
    "promise_heat"
  ]
}
